{
  "schemaVersion": "1.0",
  "date": "2026-02-04",
  "country": "TG",
  "countryName": "Togo",
  "countryNames": {
    "fr": "Togo",
    "en": "Togo"
  },
  "timezone": "Africa/Lome",
  "dayOfWeek": 3,
  "isWeekend": false,
  "isPublicHoliday": false,
  "isWorkingDay": true,
  "isFirstWorkingDayOfMonth": false,
  "isLastWorkingDayOfMonth": false,
  "isRamadanPeriod": false,
  "holidayName": null,
  "holidayType": null,
  "religiousAffiliation": null,
  "observedDate": null,
  "legalBasis": null,
  "source": null,
  "verifiedAt": "2026-05-31",
  "confidence": "confirmed",
  "weekNumber": 6,
  "quarter": 1,
  "workingDayOfMonth": 3,
  "workingDayOfYear": 23
}