{
  "schemaVersion": "1.0",
  "date": "2026-08-25",
  "country": "BJ",
  "countryName": "Bénin",
  "countryNames": {
    "fr": "Bénin",
    "en": "Benin"
  },
  "timezone": "Africa/Porto-Novo",
  "dayOfWeek": 2,
  "isWeekend": false,
  "isPublicHoliday": false,
  "isWorkingDay": true,
  "isFirstWorkingDayOfMonth": false,
  "isLastWorkingDayOfMonth": false,
  "isRamadanPeriod": false,
  "holidayName": null,
  "holidayType": null,
  "religiousAffiliation": null,
  "observedDate": null,
  "legalBasis": null,
  "source": null,
  "verifiedAt": "2026-01-01",
  "confidence": "confirmed",
  "weekNumber": 35,
  "quarter": 3,
  "workingDayOfMonth": 17,
  "workingDayOfYear": 162
}