{
  "schemaVersion": "1.0",
  "date": "2026-07-11",
  "country": "BJ",
  "countryName": "Bénin",
  "countryNames": {
    "fr": "Bénin",
    "en": "Benin"
  },
  "timezone": "Africa/Porto-Novo",
  "dayOfWeek": 6,
  "isWeekend": true,
  "isPublicHoliday": false,
  "isWorkingDay": false,
  "isFirstWorkingDayOfMonth": false,
  "isLastWorkingDayOfMonth": false,
  "isRamadanPeriod": false,
  "holidayName": null,
  "holidayType": null,
  "religiousAffiliation": null,
  "observedDate": null,
  "legalBasis": null,
  "source": null,
  "verifiedAt": "2026-05-08",
  "confidence": "confirmed",
  "weekNumber": 28,
  "quarter": 3,
  "workingDayOfMonth": null,
  "workingDayOfYear": null
}