{
  "schemaVersion": "1.0",
  "date": "2026-05-27",
  "country": "BJ",
  "countryName": "Bénin",
  "countryNames": {
    "fr": "Bénin",
    "en": "Benin"
  },
  "timezone": "Africa/Porto-Novo",
  "dayOfWeek": 3,
  "isWeekend": false,
  "isPublicHoliday": true,
  "isWorkingDay": false,
  "isFirstWorkingDayOfMonth": false,
  "isLastWorkingDayOfMonth": false,
  "isRamadanPeriod": false,
  "holidayName": {
    "fr": "Aïd el-Kébir (Tabaski)",
    "en": "Eid al-Adha"
  },
  "holidayType": "religious",
  "religiousAffiliation": "islamic",
  "observedDate": null,
  "legalBasis": "Loi n° 90-019 du 27 juillet 1990 fixant les fêtes légales en République du Bénin",
  "source": null,
  "verifiedAt": "2026-05-08",
  "confidence": "tentative",
  "weekNumber": 22,
  "quarter": 2,
  "workingDayOfMonth": null,
  "workingDayOfYear": null
}