{
  "schemaVersion": "1.0",
  "date": "2026-11-01",
  "country": "TG",
  "countryName": "Togo",
  "countryNames": {
    "fr": "Togo",
    "en": "Togo"
  },
  "timezone": "Africa/Lome",
  "dayOfWeek": 7,
  "isWeekend": true,
  "isPublicHoliday": true,
  "isWorkingDay": false,
  "isFirstWorkingDayOfMonth": false,
  "isLastWorkingDayOfMonth": false,
  "isRamadanPeriod": false,
  "holidayName": {
    "fr": "Toussaint",
    "en": "All Saints' Day"
  },
  "holidayType": "religious",
  "religiousAffiliation": "christian",
  "observedDate": null,
  "legalBasis": "Ordonnance n° 79/10 réglementant le régime des fêtes légales",
  "source": null,
  "verifiedAt": "2026-05-31",
  "confidence": "tentative",
  "weekNumber": 44,
  "quarter": 4,
  "workingDayOfMonth": null,
  "workingDayOfYear": null
}